{
  "kbVersion": "1.0.0",
  "generated": "2026-10-01",
  "curator": "Literature Curator + Data-Rigor Lead (Opus)",
  "schema": "./schema.json",
  "entities": [
    {
      "id": "organism:body",
      "type": "organism",
      "name": "Whole body",
      "synonyms": [
        "organism",
        "reference adult"
      ],
      "scale": 0,
      "parent": null,
      "externalIds": {
        "UBERON": "UBERON:0000468"
      },
      "summary": "70 kg reference adult. Total body water about 42 L: about 14 L extracellular (plasma plus interstitial fluid) and 28 L intracellular.",
      "evidence": [
        "ev:guyton-hall-2021"
      ],
      "quantities": [
        "V_ecf",
        "V_icf"
      ]
    },
    {
      "id": "system:cardiovascular",
      "type": "organ_system",
      "name": "Cardiovascular system",
      "synonyms": [],
      "scale": 1,
      "parent": "organism:body",
      "externalIds": {
        "UBERON": "UBERON:0004535"
      },
      "summary": "Heart and blood vessels. Sets arterial pressure, which drives glomerular filtration and pressure natriuresis; atrial stretch releases ANP.",
      "evidence": [
        "ev:guyton-hall-2021"
      ]
    },
    {
      "id": "system:renal",
      "type": "organ_system",
      "name": "Renal and urinary system",
      "synonyms": [
        "urinary system",
        "renal system"
      ],
      "scale": 1,
      "parent": "organism:body",
      "externalIds": {
        "UBERON": "UBERON:0001008"
      },
      "summary": "Kidneys, ureters and bladder. Filters plasma and adjusts water and electrolyte excretion to match intake.",
      "evidence": [
        "ev:guyton-hall-2021"
      ]
    },
    {
      "id": "system:gi",
      "type": "organ_system",
      "name": "Digestive system",
      "synonyms": [
        "gastrointestinal system",
        "GI tract"
      ],
      "scale": 1,
      "parent": "organism:body",
      "externalIds": {
        "UBERON": "UBERON:0001007"
      },
      "summary": "Gut and accessory organs. Absorbs ingested water and sodium; the liver secretes angiotensinogen.",
      "evidence": [
        "ev:guyton-hall-2021",
        "ev:leiper-2015"
      ]
    },
    {
      "id": "system:endocrine",
      "type": "organ_system",
      "name": "Endocrine system",
      "synonyms": [],
      "scale": 1,
      "parent": "organism:body",
      "externalIds": {
        "UBERON": "UBERON:0000949"
      },
      "summary": "Hormone-secreting glands. In V1: posterior pituitary (vasopressin), adrenal cortex (aldosterone), and cardiac atria (ANP, endocrine function of the heart).",
      "evidence": [
        "ev:guyton-hall-2021"
      ]
    },
    {
      "id": "system:nervous",
      "type": "organ_system",
      "name": "Nervous system",
      "synonyms": [],
      "scale": 1,
      "parent": "organism:body",
      "externalIds": {
        "UBERON": "UBERON:0001016"
      },
      "summary": "Brain and nerves. In V1: osmoreceptors in the lamina terminalis and hypothalamus, and the thirst circuit.",
      "evidence": [
        "ev:guyton-hall-2021",
        "ev:bourque-2008"
      ]
    },
    {
      "id": "system:musculoskeletal",
      "type": "organ_system",
      "name": "Musculoskeletal system",
      "synonyms": [],
      "scale": 1,
      "parent": "organism:body",
      "externalIds": {
        "UBERON": "UBERON:0002204"
      },
      "summary": "Bones and skeletal muscle. In V1, skeletal muscle stands in for the intracellular fluid compartment, which it dominates by volume.",
      "evidence": [
        "ev:guyton-hall-2021"
      ]
    },
    {
      "id": "system:integumentary",
      "type": "organ_system",
      "name": "Integumentary system",
      "synonyms": [
        "integumental system"
      ],
      "scale": 1,
      "parent": "organism:body",
      "externalIds": {
        "UBERON": "UBERON:0002416"
      },
      "summary": "Skin and appendages. Route of insensible and sweat water loss; interstitial sodium storage is reported but not modelled in V1.",
      "evidence": [
        "ev:guyton-hall-2021",
        "ev:wiig-2018"
      ]
    },
    {
      "id": "system:respiratory",
      "type": "organ_system",
      "name": "Respiratory system",
      "synonyms": [],
      "scale": 1,
      "parent": "organism:body",
      "externalIds": {
        "UBERON": "UBERON:0001004"
      },
      "summary": "Airways and lungs. In V1 only as a site of angiotensin-converting enzyme and of respiratory insensible water loss.",
      "evidence": [
        "ev:guyton-hall-2021",
        "ev:sparks-2014"
      ]
    },
    {
      "id": "organ:heart",
      "type": "organ",
      "name": "Heart",
      "synonyms": [],
      "scale": 2,
      "parent": "system:cardiovascular",
      "externalIds": {
        "UBERON": "UBERON:0000948"
      },
      "summary": "Pumps about 5 L/min at rest. In this model mean arterial pressure follows ECF volume; the badge on the heart shows the simulated MAP.",
      "evidence": [
        "ev:guyton-hall-2021"
      ],
      "system": "cardiovascular",
      "quantities": [
        "MAP"
      ]
    },
    {
      "id": "organ:aorta",
      "type": "organ",
      "name": "Aorta",
      "synonyms": [],
      "scale": 2,
      "parent": "system:cardiovascular",
      "externalIds": {
        "UBERON": "UBERON:0000947"
      },
      "summary": "Main artery leaving the left ventricle. Its pressure drives glomerular filtration in the kidneys.",
      "evidence": [
        "ev:guyton-hall-2021"
      ],
      "system": "cardiovascular",
      "quantities": [
        "MAP"
      ]
    },
    {
      "id": "organ:vena-cava",
      "type": "organ",
      "name": "Venae cavae",
      "synonyms": [
        "vena cava"
      ],
      "scale": 2,
      "parent": "system:cardiovascular",
      "externalIds": {
        "UBERON": "UBERON:0004087"
      },
      "summary": "Large veins returning blood to the right atrium. Atrial stretch releases ANP when ECF volume expands.",
      "evidence": [
        "ev:guyton-hall-2021",
        "ev:potter-2006"
      ],
      "system": "cardiovascular",
      "quantities": [
        "V_ecf"
      ]
    },
    {
      "id": "organ:kidney",
      "type": "organ",
      "name": "Kidneys",
      "synonyms": [
        "kidney"
      ],
      "scale": 2,
      "parent": "system:renal",
      "externalIds": {
        "UBERON": "UBERON:0002113"
      },
      "summary": "Filter about 180 L of plasma a day (GFR about 125 mL/min) and return over 99% of filtered water and sodium. They set urine volume and concentration under ADH, aldosterone and ANP.",
      "evidence": [
        "ev:guyton-hall-2021",
        "ev:palmer-schnermann-2015"
      ],
      "system": "renal",
      "quantities": [
        "GFR",
        "urine_flow",
        "U_osm",
        "strain_index"
      ]
    },
    {
      "id": "organ:ureters",
      "type": "organ",
      "name": "Ureters",
      "synonyms": [
        "ureter"
      ],
      "scale": 2,
      "parent": "system:renal",
      "externalIds": {
        "UBERON": "UBERON:0000056"
      },
      "summary": "Carry urine from each kidney to the bladder.",
      "evidence": [
        "ev:guyton-hall-2021"
      ],
      "system": "renal",
      "quantities": [
        "urine_flow"
      ]
    },
    {
      "id": "organ:bladder",
      "type": "organ",
      "name": "Bladder",
      "synonyms": [
        "urinary bladder"
      ],
      "scale": 2,
      "parent": "system:renal",
      "externalIds": {
        "UBERON": "UBERON:0001255"
      },
      "summary": "Stores urine. The viewer grows it with urine made since the last void and empties it at 0.4 L. That void rule is a display choice, not part of the model.",
      "evidence": [
        "ev:guyton-hall-2021"
      ],
      "system": "renal",
      "quantities": [
        "urine_flow"
      ]
    },
    {
      "id": "organ:stomach",
      "type": "organ",
      "name": "Stomach",
      "synonyms": [],
      "scale": 2,
      "parent": "system:gi",
      "externalIds": {
        "UBERON": "UBERON:0000945"
      },
      "summary": "Receives drinks and food; gastric emptying gates delivery to the intestine. In the model, ingested water and salt sit in a single gut pool before absorption.",
      "evidence": [
        "ev:guyton-hall-2021",
        "ev:leiper-2015"
      ],
      "system": "gi",
      "quantities": [
        "V_gut_water",
        "Na_gut"
      ]
    },
    {
      "id": "organ:intestine",
      "type": "organ",
      "name": "Intestines",
      "synonyms": [
        "intestine",
        "gut"
      ],
      "scale": 2,
      "parent": "system:gi",
      "externalIds": {
        "UBERON": "UBERON:0000160"
      },
      "summary": "Absorb most ingested water and sodium. Plain water is absorbed with a half-time of minutes (deuterium tracer studies).",
      "evidence": [
        "ev:guyton-hall-2021",
        "ev:peronnet-2012",
        "ev:leiper-2015"
      ],
      "system": "gi",
      "quantities": [
        "V_gut_water",
        "Na_gut"
      ]
    },
    {
      "id": "organ:small-intestine",
      "type": "organ",
      "name": "Small intestine",
      "synonyms": [],
      "scale": 2,
      "parent": "organ:intestine",
      "externalIds": {
        "UBERON": "UBERON:0002108"
      },
      "summary": "Main site of absorption of ingested water and sodium.",
      "evidence": [
        "ev:guyton-hall-2021",
        "ev:leiper-2015"
      ]
    },
    {
      "id": "organ:liver",
      "type": "organ",
      "name": "Liver",
      "synonyms": [],
      "scale": 2,
      "parent": "system:gi",
      "externalIds": {
        "UBERON": "UBERON:0002107"
      },
      "summary": "Secretes angiotensinogen, the substrate of renin. Included in V1 only for the renin-angiotensin pathway.",
      "evidence": [
        "ev:guyton-hall-2021",
        "ev:sparks-2014"
      ]
    },
    {
      "id": "organ:lung",
      "type": "organ",
      "name": "Lung",
      "synonyms": [